sureh,ayeh,matn,processed matn
37,65,شکوفه‌ی آن مانند سرهای شیطان‌ها [بسیار زشت و بدنما] است.,شکوفه سر شیطان زشت بدنما 
37,69,[چرا که] آنان پدران خویش را گمراه یافتند.,پدران گمراه یافت 
37,70,امّا با این حال، در پی آنان شتابان می‌دوند.,شتابان دوید 
37,77,و نسل او را باقی گذاشتیم.,نسل باقی گذاشت 
37,79,سلام بر نوح در میان جهانیان.,سلام نوح جهانیان 
37,89,و گفت: «من در آستانه‌ی بیماری‌ام [و نمی‌توانم در مراسم شما شرکت کنم.]»,آستانه بیماری توانست مراسم شرکت 
37,90,مردم از او روی گردانده، برگشتند.,مردم گردانده برگشت 
37,92,شما را چه شده؟ چرا سخن نمی‌گویید؟»,شده؟ سخن نمی‌گویید؟ 
37,96,در حالی که خداوند، شما و آنچه را می‌سازید، آفریده است.»,خداوند ساخت آفریده 
37,100,پروردگارا! [فرزندی] از صالحان به من عطا فرما!»,پروردگارا فرزندی صالحان عطا فرما 
37,101,پس ما او را به نوجوانی بردبار مژده دادیم.,نوجوانی بردبار مژده داد 
37,104,حقّاً که رؤیایت را تحقّق بخشیدی [و امر ما را اطاعت کردی].»,حقا رؤیا تحقق بخشید اطاعت کردی 
37,106,همانا این همان آزمایش آشکار بود.,همانا آزمایش آشکار 
37,107,و ما او را در برابر قربانی بزرگی [از ذبح شدن‌] رهانیدیم.,قربانی بزرگی ذبح رهانیدیم 
37,112,و او را به اسحاق مژده دادیم که پیامبری از شایستگان بود.,اسحاق مژده داد پیامبری شایستگان 
37,123,و به راستی اِلیاس از فرستادگان [ما] بود.,راستی الیاس فرستادگان 
37,130,سلام و درود بر الیاس.,سلام درود الیاس 
37,133,و همانا لوط یکی از فرستادگان [ما] بود.,همانا لوط فرستادگان 
37,135,جز پیرزنی که در میان بازماندگان [و هلاک‌شدگان] بود.,پیرزن بازماندگان هلاک‌شدگان 
37,138,[و نیز] شبانگاه؛ پس آیا نمی‌اندیشید؟,شبانگاه؛ نمی‌اندیشید؟ 
37,139,و همانا یونس از فرستادگان [ما] بود.,همانا یونس فرستادگان 
37,143,[در شکم ماهی به تسبیح خداوند پرداخت]. پس اگر از تسبیح‌گویان نبود،,شکم ماهی تسبیح خداوند پرداخت تسبیح‌گو 
37,146,و بر او بوته‌ای از کدو رویاندیم.,بوته کدو رویاند 
37,155,پس آیا پند نمی‌گیرید؟,پند نمی‌گیرید؟ 
37,156,آیا برای شما دلیل روشنی است؟,دلیل روشنی است؟ 
37,166,و ماییم که تسبیح‌گوی هستیم.»,ما تسبیح‌گوی 
37,167,[مشرکان پیش از بعثت پیامبر] پیوسته و با تأکید می‌گفتند:,مشرک بعثت پیامبر پیوسته تأکید گفت 
37,172,همانا ایشانند که پیروزند.,همانا ایشانند پیروزند 
37,173,و سپاه ماست که پیروز است.,سپاه ماست پیروز 
37,174,پس تا مدّتی [معین از کافران] روی بگردان.,مدتی معین کافر بگرد 
37,178,و تا مدّتی [معین] از آنان روی بگردان.,مدتی معین بگرد 
37,181,و سلام بر همه‌ی فرستادگان.,سلام همه فرستادگان 
38,4,و کافران تعجب کردند که هشداردهنده‌ای از خودشان به سراغشان آمده و گفتند: «این، جادوگری دروغگوست.,کافر تعجب هشداردهنده خودشان سراغ گفت جادوگری دروغگوست 
38,7,ما این چیزها را [که محمّد می‌گوید،] در آخرین آیین نشنیده‌ایم. این آیین، آیینی ساختگی است.,چیزها محمد آیین شنید آیین آیینی ساختگی 
38,11,آنان لشکر کوچکی از احزابِ شکست‌خورده‌اند.,لشکر کوچکی احزاب شکست‌خورده‌اند 
38,15,گویا این کافران تنها چشم به راه صیحه‌ای مرگبارند، که به دنبالش بازگشتی برای آنان نیست،,گویا کافر چشم صیحه مرگبارند دنبال بازگشتی 
38,21,و آیا خبر آن دادخواهان به تو رسیده است که از دیوار محراب [داود] بالا رفتند؟,خبر دادخواه رسیده دیوار محراب داوید رفتند؟ 
38,23,این برادر من است که نود و نُه میش دارد و من تنها یک میش دارم؛ امّا [با آن همه سرمایه، به من] می‌گوید: آن یک میش را هم به من واگذار! و در گفتگو بر من چیره شده است.»,برادر نود میش میش دارم؛ سرمایه میش واگذار گفتگو چیره 
38,25,پس ما آن [قضاوت] را بر او بخشیدیم. و البتّه او نزد ما مقامی والا و سرانجامی نیک دارد.,قضاوت بخشید نزد مقامی والا سرانجامی نیک 
38,30,و ما به داود سلیمان را بخشیدیم. او بنده‌ی خوبی بود، زیرا بسیار به درگاه ما روی می‌آورد.,داوید سلیمان بخشید بنده درگاه آورد 
38,38,و گروه دیگری از جنّ‌ها با غل و زنجیر به هم بسته بودند. [تا نتوانند در حکومت او فتنه و آشوب کنند.],گروه جن غل زنجیر بسته توانست حکومت فتنه آشوب 
38,40,و او نزد ما مقامی والا و سرانجامی نیک دارد.,نزد مقامی والا سرانجامی نیک 
38,42,[به او گفتیم:] «پای خود را بر زمین بزن [تا از زیر پای تو چشمه‌ای جاری کنیم]. این چشمه‌ی آبی خنک برای شستشو و نوشیدن است.»,گفت پای زمین بزن پای چشمه چشمه آبی خنک شستشو نوشید 
38,47,و آنان در پیشگاه ما از برگزیدگان و نیکانند.,پیشگاه برگزیدگان نیکانند 
38,54,این روزی ماست که برای آن پایانی نیست.,روزید ماست پایانی 
38,62,و می‌گویند: «چرا مردانی را که ما آنها را از اشرار می‌شمردیم، نمی‌بینیم؟,مردانی اشرار شمرد نمی‌بینیم؟ 
38,68,که شما از آن روی‌گردانید.,روی‌گردانید 
38,80,[خداوند] فرمود: «تو از مهلت داده‌شدگانی!,خداوند فرمود مهلت داده‌شدگانی 
38,83,مگر بندگان خالص شده‌ات را.»,مگر بندگان خالص شده 
39,12,و فرمان یافته‌ام که نخستینِ مسلمانان باشم.»,فرمان یافت مسلمان باشید 
39,33,ولی کسی که [دین] راستین آورد و آن را باور کرد، آنانند تقواپیشگان.,دین راستین باور آنانند تقواپیشگان 
40,1,حا، میم.,حا  
40,73,سپس به آنان گفته می‌شود: «کجایند آن شریک‌هایی که،,کجایند شریک 
41,1,حا، میم.,حا  
41,42,در حال و آینده‌ی آن، باطل راه ندارد. فروفرستاده‌ای از سوی [خداوند] فرزانه‌ی ستوده است.,آینده باطل فروفرستاده خداوند فرزانه ستوده 
41,47,آگاهی به زمان وقوع قیامت، تنها به خداوند بازمی‌گردد. و هیچ میوه‌ای از شکوفه‌های خود خارج نمی‌شود، و هیچ ماده‌ای باردار نمی‌شود و نمی‌زاید، مگر به علم او. و روزی که [خداوند] مشرکان را ندا کند: «شریکان من کجا هستند؟» می‌گویند: «با بانگ رسا به تو می‌گوییم: هیچ گواهی [بر گفتار و عقیده‌ی خود] نداریم.»,آگاهی زمان وقوع قیامت خداوند بازمی‌گردد میوه‌ای شکوفه خارج ماده باردار زاد مگر علم روزید خداوند مشرک ندا شریک کجا هستند؟ بانگ رسا گفت گواهی گفتار عقیده داشت 
41,48,و هر چه را که از پیش همواره می‌خواندند، از نزد آنان گم می‌شود. و می‌فهمند که هیچ راه فراری ندارند.,خواند نزد گم فهمید فراری 
42,1,حا، میم.,حا  
42,2,عین، سین، قاف.,سین قاف 
42,28,و اوست که باران را پس از این که [مردم از آمدنش‌] نومید شدند، فرومی‌فرستد، و رحمت خویش را می‌گسترد. و اوست سرور ستوده!,اوست باران این‌که مردم آمدن نومید فرومی‌فرستد رحمت گسترد اوست سرور ستوده 
42,30,و هر مصیبتی به شما برسد، پس به خاطر دستاورد خود شماست. و او از بسیاری [گناهانتان] درمی‌گذرد.,مصیبتی رسید خاطر دستاورد شماست گناهانتان درمی‌گذرد 
42,37,کسانی که خود را از گناهان بزرگ و زشتی‌ها دور می‌کنند، و چون به خشم آیند، درمی‌گذرند.,گناه زشتی خشم آمد درمی‌گذرند 
42,41,و کسانی که پس از ستم [دیدنِ] خود، یاری جویند، [و عادلانه انتقام بگیرند،] راه [نکوهشی] بر آنان نیست.,ستم دیدن یاری جست عادلانه انتقام گرفت نکوهش 
43,1,حا، میم.,حا  
43,4,وآن درام ُّالکتاب، [لوح محفوظ،] نزد ما، بلندمرتبه و حکمت‌آمیز و استوار است.,وآن درام الکتاب لوح محفوظ نزد بلندمرتبه حکمت‌آمیز استوار 
43,18,آیا کسی را که در زر و زیور پرورش یافته و در مجادله بیانش روشن نیست، [فرزند خدا می‌خوانید]؟,زر زیور پرورش‌یافته مجادله بیان روشن فرزند خدا می‌خوانید؟ 
43,21,یا پیش از این به آنان کتابی داده‌ایم که [در ادّعاهایشان] آن را دستاویز ساخته‌اند؟,کتابی داد ادعا دستاویز ساخته‌اند؟ 
43,28,و آن [کلام توحید] را در میان نسل‌های بعد از خود، سخنی ماندگار قرار داد. باشد که آنان [به توحید] بازگردند.,کلام توحید نسل سخنی ماندگار قرار توحید بازگشت 
43,30,و چون حقّ به سراغشان آمد، گفتند: «این جادوست! و ما به آن کافریم.»,حق سراغ گفت جادوست کافر 
43,47,پس چون معجزه‌های ما را برای آنان آورد، به آن خندیدند.,معجزه خندید 
43,52,بلکه من از این کسی که بی‌مقدار است، و نمی‌تواند روشن سخن بگوید، بهترم.,بی‌مقدار توانست روشن سخن گفت بهتر 
43,57,و چون [بت‌پرستان] درباره‌ی [عیسی] پسر مریم مثالی زدند ناگهان قوم تو فریاد تمسخر برداشتند.,بت‌پرستان درباره عیسی پسر مریم مثالی زد ناگهان قوم فریاد تمسخر برداشتند 
43,58,و گفتند: «آیا خدایان ما بهترند یا او؟» این مثال را برای تو تنها از راه جدال [و لجاجت] زدند، بلکه آنان گروهی کینه‌توز و پرخاشگرند.,گفت خدا بهترند او؟ مثال جدال لجاجت زد کینه‌توز پرخاشگرند 
43,66,آیا جز قیامت را انتظار می‌برند که ناگهان به سراغشان آید، در حالی که بی‌خبر باشند؟,قیامت انتظار برد ناگهان سراغ آمد بی‌خبر باشند؟ 
43,71,ظرف‌هایی از طلا و جام‌هایی [زرین] بر گرد آنان می‌چرخانند. و در آنجا آنچه دل‌ها بخواهد و چشم‌ها از آن لذّت برد، فراهم است. و شما [ای پرهیزکاران!] در آن جاودانه‌اید.,ظرف طلا جام زرین گرد چرخاند دل خواست چشم لذت برد فراهم شما پرهیزکار جاودانه‌اید 
43,78,به راستی ما حقّ را برای شما آوردیم؛ ولی بیشتر شما حقّ را نمی‌پسندید.,راستی حق آوردیم؛ حق پسندید 
43,80,آیا آنان می‌پندارند که ما رازهای پنهانی و سخنان درِ گوشی آنان را نمی‌شنویم؟ چرا! و فرستادگان ما نزد آنان حضور دارند و [همه چیز را] ثبت می‌کنند.,پندارید راز پنهانی سخنان گوشید نمی‌شنویم؟ فرستادگان نزد حضور ثبت 
44,1,حا، میم.,حا  
44,10,پس منتظر روزی باش که آسمان دودِ نمایانی را با خود می‌آورد.,منتظر روزید باش آسمان دود نمایان آورد 
44,14,سپس از او روی گرداندند و گفتند: «او جنّ‌زده‌ای است که تعلیمش داده‌اند.»,گرداند گفت جن‌زده تعلیم داد 
44,27,و ناز و نعمتی که در آن خوش بودند.,ناز نعمتی خوش 
44,32,و همانا ما آنان را با علم [خود] بر جهانیانِ [هم‌عصرشان] برگزیدیم.,همانا علم جهانیان هم‌عصر برگزیدیم 
44,34,البتّه این مشرکان [روزگار تو] پیوسته می‌گویند:,مشرک روزگار پیوسته 
44,36,پس اگر شما [پیامبران درباره‌ی معاد] راستگو هستید، پدران ما را بازآورید.»,پیامبر درباره معاد راستگو  پدران بازآورید 
44,49,[به او با تمسخر گفته می‌شود:] «بچش! که تو همان عزیزِ بزرگواری!,تمسخر بچش عزیز بزرگواری 
45,1,حا، میم.,حا  
45,28,و [در روز رستاخیز] هر امّتی را [از شدّت خضوع و وحشت] به زانو درآمده می‌بینی، در حالی که هر امّتی به سوی [کارنامه و] کتابش فراخوانده شده است. [و به آنان می‌گوییم:] «امروز آنچه را عمل می‌کردید، به شما پاداش می‌دهند.,روز رستاخیز امتی شدت خضوع وحشت زانو درآمده دید امتی کارنامه کتاب فراخوانده گفت امروز عمل کرد پاداش 
46,1,حا، میم.,حا  
46,15,و ما انسان را سفارش کردیم که به مادر و پدر خود نیکی کند. مادرش با سختی او را باردار بود و با سختی به دنیا آورد و دوران بارداری تا از شیر گرفتنش [دست کم] سی ماه است. تا آن‌گاه که به رشد کامل برسد و چهل ساله شود، بگوید: «پروردگارا! به دلم انداز که نعمتی را که بر من و بر پدر و مادر من لطف کردی، شکرگزارم و کار شایسته‌ای کنم که تو آن را بپسندی و فرزندانم را برای من صالح و شایسته گردان! من به سوی تو بازگشته‌ام و از تسلیم‌شدگانم.»,انسان سفارش کرد مادر پدر نیکی مادرش سختی باردار سختی دنیا دوران بارداری شیر گرفتن دست‌کم ماه آن‌گاه رسید چهل گفت پروردگارا دلم انداز نعمتی پدر مادر لطف کردی شکرگزار کار شایست پسندید فرزندان صالح شایسته گردان بازگشت تسلیم‌شدگانم 
47,14,پس آیا کسی که از سوی پروردگارش دلیل روشنی دارد، همچون کسی است که بدی کردارش در نظرش آراسته شده و از هوس‌هایش پیروی کرده است؟,پروردگار دلیل روشنی بدی کردار نظرش آراسته هوس پیروی است؟ 
47,15,وصف بهشتی که به پرهیزکاران وعده داده شده، [چنین است:] در آن نهرهایی است از آب که [رنگ و بو و طعمش] برنمی‌گردد و نهرهایی از شیر که مزه‌ی آن دگرگونی ندارد و نهرهایی از شراب که برای نوشندگان لذّت‌بخش است و نهرهایی از عسل ناب و در آنجا از هرگونه میوه برای آنان [فراهم‌] است و [از همه بالاتر،] آمرزشی از سوی پروردگارشان. [آیا اینان] همانند کسانی هستند که در آتش، جاودانه‌اند و آبی جوشان به خوردشان داده می‌شود که دل و روده‌هایشان را پاره پاره می‌کند و اندرونشان را می‌سوزاند؟,وصف بهشتی پرهیزکار وعده داده‌شده نهر آب رنگ بو طعم برنمی‌گردد نهر شیر مزه دگرگونی نهر شراب نوشندگان لذت‌بخش نهر عسل ناب هرگونه میوه فراهم بالاتر آمرزش پروردگار اینان همانند آتش جاودانه‌اند آبی جوشان خوردشان دل روده پاره‌پاره اندرون می‌سوزاند؟ 
47,22,پس [ای بیماردلانِ سست ایمان!] اگر روی گردانید، جز این از شما انتظار می‌رود که در زمین فساد کنید و پیوندهای خویشاوندی را بگسلید؟,پس بیماردل سست ایمان گرداند انتظار زمین فساد پیوند خویشاوندی بگسلید؟ 
48,6,و مردان و زنان منافق و مردان و زنان مشرک را که به خداوند گمان بد دارند، [که پیامبرش را یاری نخواهد کرد،] عذاب کند. پیشامدِ بدِ زمانه بر آنان باد! خداوند بر آنان غضب کرده و از رحمت خود دورشان ساخته و برایشان جهنّم را آماده کرده است و بد سرانجامی است!,مردان زنان منافق مردان زنان مشرک خداوند گمان بد پیامبر یاری خواست عذاب پیشامد بد زمانه باد خداوند غضب رحمت دور ساخته برایشان جهنم آماده بد سرانجامی 
48,21,و [غنیمت‌های] دیگری که شما بر آنها قدرت ندارید؛ ولی خداوند بر آنها احاطه دارد و خداوند بر هر چیزی تواناست.,غنیمت قدرت ندارید؛ خداوند احاطه خداوند تواناست 
49,4,کسانی که از پشت اتاق‌ها[ی خانه‌ات] تو را با فریاد صدا می‌زنند، بیشترشان نمی‌اندیشند. [که باید احترام تو را نگاه دارند.],اتاق خانه فریاد صدا زد بیشتر اندیشید احترام نگاه 
50,2,[آنان ایمان نیاوردند،] بلکه از آمدن پیامبری هشداردهنده از میان خودشان در شگفت شدند. پس کافران گفتند: «این [سخنان که از قیامت خبر می‌دهد،] چیز عجیبی است!,ایمان نیاوردند آمدن پیامبری هشداردهنده خودشان شگفت کافر گفت سخنان قیامت خبر عجیبی 
50,7,و زمین را گستردیم و کوه‌های استوار در آن افکندیم و از هر نوع گیاه باطراوت در آن رویاندیم.,زمین گسترد کوه استوار افکند گیاه باطراوت رویاند 
50,10,و نیز درختان بلند خرما، با خوشه‌هایی پر و بر هم چیده [رویاندیم].,درختان بلند خرما خوشه چیده رویاند 
50,15,مگر در آفرینش نخستین درماندیم [که از بازآفریدن در رستاخیز ناتوان باشیم؟ نه!] بلکه آنان درباره‌ی آفرینش جدید در تردیدند.,مگر آفرینش درماندیم بازآفریدن رستاخیز ناتوان باشیم؟ درباره آفرینش تردیدند 
50,23,و [فرشته‌ی] همراه او می‌گوید: «این [نامه‌ی اعمال اوست که] نزد من آماده است.»,فرشته همراه نامه اعمال اوست نزد آماده 
50,37,در این [نابودی سرکشان]، پندی است برای کسی که دلی [بیدار] دارد، یا با حضور قلب، [به حقایق] گوش فرادهد.,نابودی سرک پندی دلی بیدار حضور قلب حقایق گوش فرادهد 
50,41,و گوش فرا ده و منتظر روزی باش که منادی از مکانی نزدیک ندا می‌دهد.,گوش فرا ده منتظر روزید باش منادی مکانی ندا 
51,11,آنان که در بی‌خبری و غفلت غرقند.,بی‌خبری غفلت غرقند 
51,19,و در دارایی‌هایشان، حقّی بود برای نیازمند خواهنده و بینوای درمانده.,دارایی حقی نیازمند خواهنده بینوا درمانده 
51,21,و در [آفرینش] خودتان [نیز نشانه‌هایی است]. پس چرا نمی‌نگرید؟,آفرینش خودتان نشانه نمی‌نگرید؟ 
51,45,پس، نه توان برخاستن داشتند و نه توانستند از خود دفاع کنند.,توان برخاستن توانست دفاع 
51,47,و آسمان را با قدرتی وصف‌ناپذیر ساختیم و ما همواره آن را وسعت می‌بخشیم.,آسمان قدرتی وصف‌ناپذیر ساخت وسعت بخشید 
51,54,پس، از آنان روی بگردان که تو مورد سرزنش نیستی.,بگرد سرزنش نیستی 
52,3,در صفحه‌ای گشوده!,صفحه‌ای گشوده 
52,8,بازدارنده‌ای ندارد.,بازدارنده 
52,19,[به آنان گفته می‌شود:] «به خاطر اعمالی که انجام می‌دادید، گوارا بخورید و بیاشامید!»,خاطر اعمال انجام داد گوارا خورد بیاشامید 
52,24,و [برای خدمت به آنان،] پیوسته نوجوانانی گردشان می‌چرخند، که همچون مروارید در صدفند.,خدمت پیوسته نوجوانانی گرد چرخید مروارید صدفند 
52,30,بلکه [کافران] می‌گویند: «او شاعری است که ما برای او چشم به راه حوادث تلخ و مرگ او هستیم.»,کافر شاعری چشم حوادث تلخ مرگ 
52,31,[به آنان] بگو: «در انتظار باشید که من نیز با شما در انتظار می‌مانم. [شما در انتظار مرگ من و من در انتظار پیروزی بر شما.]»,بگو انتظار باشید انتظار ماند انتظار مرگ انتظار پیروزی 
52,32,آیا خردهایشان آنان را به این [یاوه‌گویی‌ها] وامی‌دارد؟ یا آنان قومی سرکشند؟,خرد یاوه‌گویی وامی‌دارد؟ قومی سرکشند؟ 
52,34,پس اگر راستگویند، سخنی مانند آن بیاورند.,راستگویند سخنی بیاورند 
52,37,آیا گنجینه‌های پروردگارت نزد آنان است؟ یا آنها [براین عالم] چیرگی دارند؟,گنجینه پروردگار نزد است؟ براین عالم چیرگی دارند؟ 
52,38,آیا نردبانی دارند که با آن [اسرار آسمان‌ها را] می‌شنوند؟ پس شنونده‌ی آنان دلیلی روشن بیاورد.,نردبان اسرار آسمان می‌شنوند؟ شنونده دلیلی روشن بیاورد 
52,41,آیا غیب نزد آنان است و ایشان [هرچه را می‌خواهند، در لوح محفوظ] می‌نویسند؟,غیب نزد هرچه خواست لوح محفوظ می‌نویسند؟ 
53,2,یار و همنشین شما [محمّد]، نه گمراه شده و نه منحرف گشته است.,یار همنشین محمد گمراه منحرف گشته 
53,6,[همان که] درایت و توانمندی شگفتی دارد، پس چیره است.,درایت توانمندی شگفت چیره 
53,7,در حالی که او در افق برتر بود،,افق برتر 
53,8,سپس نزدیک و نزدیک‌تر شد.,نزدیک 
53,9,تا جایی که فاصله‌اش به اندازه‌ی دو کمان یا کمتر شد.,فاصله اندازه کمان کمتر 
53,12,پس آیا بر سر آنچه می‌بیند، با وی بحث و جدال می‌کنید؟,سر دید بحث جدال می‌کنید؟ 
53,14,نزد سدرة المنتهی.,نزد سدرة المنتهی 
