sureh,ayeh,matn,processed matn
1,5,[خدایا!] تنها تو را می‌پرستیم و تنها از تو یاری می‌جوییم.,خدایا پرستید یاری جست 
1,7,راه کسانی که به آنان نعمت دادی، نه کسانی که مورد غضب واقع شدند و نه گمراهان.,نعمت داد غضب واقع گمراه 
2,7,خداوند بر دل‌ها و بر گوش آنان مهر زده است و در برابر چشمانشان پرده‌ای است و عذاب بزرگی در انتظار آنهاست.,خداوند دل گوش مهر زده چشمانشان پرده عذاب بزرگی انتظار آنهاست 
2,15,خداوند آنان را به استهزا می‌گیرد و آنان را در طغیانشان مهلت می‌دهد تا سرگردان شوند.,خداوند استهزا طغیان مهلت سرگردان 
2,18,آنان [از شنیدن حقّ] کر و [از گفتن حقّ] گنگ و [از دیدن حقّ] کورند، پس ایشان [به سوی حقّ] بازنمی‌گردند.,شنیدن حق کر گفتن حق گنگ دیدن حق کورند حق بازنمی‌گردند 
2,19,یا چون [گرفتاران در] بارانی تند از آسمانند که در شبی تاریک همراه با رعد و برق [در بیابان] ببارد، [آنان] از ترس صاعقه‌ها و بیم مرگ، انگشتان خود را در گوش‌هایشان قرار می‌دهند، و[لی] خداوند بر کافران احاطه دارد.,گرفتار بارانی تند آسمانند شبی تاریک همراه رعد برق بیابان ببارد ترس صاعقه بیم مرگ انگشتان گوش قرار خداوند کافر احاطه 
2,20,نزدیک است که [روشنایی خیره‌کننده‌ی] برق، نور چشمانشان را برباید. هرگاه که [برق آسمان در آن صحرای تاریک و بارانی] برای آنان بدرخشد، [چند گامی] در پرتو آن راه می‌روند؛ ولی همین که تاریکی، ایشان را فراگیرد، می‌ایستند و اگر خداوند بخواهد، شنوایی و بینایی آنان را [از بین] می‌برد، همانا خداوند بر هر چیزی تواناست.,روشنایی خیره‌کننده برق نور چشمانشان ربود هرگاه برق آسمان صحرا تاریک بارانی درخشید گام پرتو می‌روند؛ تاریکی فراگرفت ایستاد خداوند خواست شنوایی بینایی برد همانا خداوند تواناست 
2,56,سپس شما را پس از مرگتان [حیات بخشیدیم و] برانگیختیم، شاید شکرگزاری کنید.,مرگ حیات بخشید برانگیختیم شکرگزاری 
2,59,امّا ستمگران [آن را] به سخن دیگری غیر از آنچه به ایشان گفته شده بود، تبدیل کردند [به جای حِطَََّه، گفتند: «حِنطَه»] پس بر آن ستمکاران به سزای گناهی که مرتکب می‌شدند، عذابی از آسمان فروفرستادیم.,ستمگر سخن گفته‌شده حطه گفت حنطه ستمکار سزید گناهی مرتکب شد عذاب آسمان فروفرستادیم 
2,71,[موسی] گفت: «خداوند می‌فرماید: آن گاوی است که نه چنان رام باشد که زمین را شخم زند و نه کشت‌زار را آبیاری کند. [بی‌عیب و] سالم است و هیچ لکه‌ای در [رنگ] آن نیست.» گفتند: «الآن حقّ [مطلب] را آوردی!» پس [چنان گاوی را پیدا کردند و] آن را سر بریدند، ولی نزدیک بود انجام ندهند.,موسی خداوند فرمود گاوی چنان رام زمین شخم زند کشت‌زار آبیاری بی‌عیب سالم لکه رنگ گفت الآن حق مطلب آورد چنان گاوی سر برید انجام داد 
2,81,آری، کسانی که مرتکب گناه شوند و گناهشان آنان را فراگیرد [و آثار گناهان سراسر وجودشان را بپوشاند]، آنها اهل آتشند و همیشه در آن خواهند بود.,آری مرتکب گناه گناه فراگرفت آثار گناه وجود پوشاند اهل آتشند خواست 
2,115,مشرق و مغرب از آن خداست، پس به هر سو رو کنید، آنجا رو به خداست، زیرا که خداوند بر همه چیز احاطه دارد و داناست.,مشرق مغرب خداست سو خداست خداوند احاطه داناست 
2,118,افراد ناآگاه گفتند: «چرا خدا با خود ما سخن نمی‌گوید؟ یا آیه و نشانه‌ای برای خود ما نمی‌آید؟» پیشینیانِ آنها نیز، همین‌گونه سخن می‌گفتند، دل‌ها [و افکار]شان مشابه یکدیگر است، ولی ما [به اندازه‌ی کافی] آیات و نشانه‌ها را برای اهل یقین [و حقیقت‌جویان] روشن ساخته‌ایم.,ناآگاه گفت خدا سخن نمی‌گوید؟ آیه نشانه نمی‌آید؟ پیشینیان همین‌گونه سخن گفت دل افکار مشابه اندازه آیات نشانه اهل یقین حقیقت‌جو روشن ساخت 
2,155,و قطعاً شما را با چیزی از قبیل ترس، گرسنگی، زیان مالی و جانی و کمبود محصولات، می‌آزماییم و صابران [در این حوادث و بلاها] را بشارت بده!,قطعا قبیل ترس گرسنگی زیان مالی جانی کمبود محصولات آزمود صابر حوادث بلا بشارت بده 
2,158,صفا و مروه، از شعائر خداست. پس هر که حجّ خانه‌ی خدا و یا عمره به جای آورد، مانعی ندارد که بین صفا و مَروه طواف کند. و [علاوه بر واجبات،] هر کس داوطلبانه کار خیری انجام دهد، همانا خداوند سپاس‌گزار داناست.,صفا مروه شعائر خداست حج خانه خدا عمره مانعی صفا مروه طواف واجبات کس داوطلبانه کار خیری انجام همانا خداوند سپاس‌گزار داناست 
2,166,در آن هنگام که عذاب را مشاهده کنند و پیوندِ میانشان بریده [و دستشان از همه چیز قطع] گردد، پیشوایان [کفر]، از پیروان خود بیزاری می‌جویند.,عذاب مشاهده پیوند میان بریده دستشان قطع پیشوا کفر پیروان بیزاری جست 
2,171,و مَثَل [تو در دعوت] کافران، چنان است که کسی حیوانی را بانگ زند که جز صدایی و آوایی نمی‌شنود؛ اینان کر و گنگ و کورند و از این روست که نمی‌اندیشند.,دعوت کافر چنان حیوانی بانگ زند صدایی آوا نمی‌شنود؛ اینان کر گنگ کورند روس اندیشید 
2,178,ای کسانی که ایمان آورده‌اید! [قانون] قِصاص در مورد کشتگان، بر شما [چنین] مقرّر گردیده است: آزاد در برابر آزاد و برده در برابر برده و زن در برابر زن، پس اگر کسی از سوی برادر [دینی] خود [که صاحب خون است،] مورد عفو قرار گیرد، [یا قصاص او به خون‌بها تبدیل شود،] باید شیوه‌ای پسندیده پیش گیرد و به نیکی [دیه را به ولیّ مقتول] بپردازد، این حکم، تخفیف و رحمتی است از ناحیه پروردگارتان، پس کسی که بعد از این [از حکم خدا] تجاوز کند، عذاب دردناکی خواهد داشت.,ای ایمان آورد قانون قصاص کشتگان مقرر گردیده آزاد آزاد برده برده زن زن برادر دینی صاحب خون عفو قرار قصاص خون‌بها شیوه پسندیده نیکی دیه مقتول پرداخت حکم تخفیف رحمت ناحیه پروردگار حکم خدا تجاوز عذاب دردناکی خواست 
2,184,روزهای محدودی [روزه بر شما مقرّر شده است]، ولی هر کس از شما بیمار یا مسافر باشد، پس [به همان] تعداد از روزهای دیگر [را روزه بگیرد]، و بر کسانی که طاقت روزه ندارند [همچون بیماران مزمن و پیران]، لازم است با اطعام مستمندی، کفّاره دهند. و هر کس به میل خود بیشتر نیکی کند، برای او بهتر است، و روزه گرفتن، برایتان بهتر است، اگر [آثار روزه را] بدانید.,روزهای محدودی روزه مقرر کس بیمار مسافر روزهای روزه گرفت طاقت روزه بیمار مزمن پیران اطعام مستمندی کفاره کس میل نیکی روزه گرفتن برا آثار روزه دانست 
2,188,و اموال یکدیگر را به باطل [و ناحقّ] در میان خود نخورید و برای خوردن بخشی از اموال مردم به گناه، آنها را به [عنوان رشوه، به کیسه‌ی] حاکمان و قاضی‌ها سرازیر نکنید. در حالی که خود می‌دانید [این کار، گناه است].,اموال باطل ناحق خورد خوردن اموال مردم گناه عنوان رشوه کیسه حاکمان قاضی سرازیر کرد دانست کار گناه 
2,196,و حجّ و عمره را برای خدا به اتمام برسانید و اگر بازداشته شدید [و موانعی مانند بیماری اجازه نداد که حجّ را کامل کنید، بر شماست] قربانی کردنِ آنچه فراهم است و سرهای خود را نتراشید تا قربانی به قربانگاه برسد و اگر کسی از شما بیمار بود یا ناراحتی در سر داشت [و ناچار بود سر خود را زودتر بتراشد،] باید به عوض آن، روزه بگیرد یا صدقه بدهد و یا گوسفندی را ذبح کند. و چون [از بیماری یا دشمن] در امان شدید، پس هر کس به دنبال عمره تمتّع، حج را آغاز کرده، آنچه را از قربانی که میسّر است [ذبح کند.] و هر کس که قربانی نیافت، سه روز در ایام حج و هفت روز به هنگامی که بازگشتید، روزه بدارد. این، ده روزِ کامل است. [البتّه] این [حجِ تمتّع] برای کسی است که خاندانش ساکن [مکه و] مسجدالحرام نباشند. و از خدا پروا کنید و بدانید که خداوند سخت‌کیفر است.,حج عمره خدا اتمام رساند بازداشته شدید موانع بیماری اجازه داد حج شماست قربانی فراهم سر تراشید قربانی قربانگاه رسید بیمار ناراحتی سر ناچار سر زودتر تراشید عوض روزه گرفت صدقه داد گوسفندی ذبح بیماری دشمن امان شدید کس دنبال عمره تمتع حج آغاز قربانی میسر ذبح کس قربانی یافت روز ایام حج هفت روز هنگامی‌که بازگشت روزه داشت ده روز حج تمتع خاندان ساکن مکه مسجدالحرام باشید خدا پروا دانست خداوند سخت‌کیفر 
2,224,و خدا را دستاویز سوگندهای خود قرار مدهید تا [بدین بهانه‌] از نیکوکاری و پرهیزکاری و سازش دادنِ میان مردم شانه خالی کنید. همانا خداوند شنوا و داناست.,خدا دستاویز سوگند قرار مدهید بدین بهانه نیکوکاری پرهیزکاری سازش مردم شانه خالی همانا خداوند شنوا داناست 
2,245,کیست که به خداوند وام دهد، وامی نیکو تا خداوند آن را برای او چندین برابر بیافزاید و خداوند [روزیِ بندگان را] محدود یا گسترده می‌سازد، و [سرانجام، همگی] به سوی او بازگردانده می‌شوید.,کیست خداوند وام وامی نیکو خداوند چندین بیافزاید خداوند روزید بندگان محدود گسترده ساخت سرانجام همگی بازگردانده شد 
2,265,و مَثَل کسانی که اموال خود را در طلب رضای خداوند و استواری روح خود انفاق می‌کنند، همچون مَثل باغی است که در نقطه‌ای بلند باشد و باران‌های درشت به آن برسد و میوه‌ی خود را دو چندان بدهد. و اگر باران درشتی نبارد، باران‌های ریز و شبنم [به آن می‌رسد تا همیشه، شاداب و پرطراوت باشد.] و خداوند به آنچه انجام می‌دهید، بیناست.,اموال طلب رضای خداوند استواری روح انفاق باغی نقطه بلند باران درشت رسید میوه چندان داد باران درشتی بارید باران ریز شبنم شاداب پرطراوت خداوند انجام داد بیناس 
2,283,و اگر در سفر بودید و نویسنده‌ای نیافتید، وثیقه‌ای بگیرید و اگر به یکدیگر اطمینان داشتید، پس [وثیقه لازم نیست و] کسی که امین شمرده شده، امانت [و بدهی خود را به موقع] بپردازد و از خدایی که پروردگار اوست، پروا کند. و شهادت را کتمان نکنید و هر کس آن را کتمان کند، بی‌شک قلبش گناهکار است. و خداوند به آنچه انجام می‌دهید، داناست.,سفر بود نویسنده یافت وثیقه گرفت اطمینان داشت وثیقه امین شمرده‌شده امانت بدهی موقع پرداخت خدایی پروردگار اوست پروا شهادت کتمان کرد کس کتمان بی‌شک قلب گناهکار خداوند انجام داد داناست 
3,13,به یقین در دو گروهی که [در جنگ بدر] با هم روبه‌رو شدند، برای شما نشانه [و درس عبرتی] بود: گروهی در راه خدا نبرد می‌کردند و گروه دیگر که کافر بودند، به چشم خود مسلمانان را دو برابر می‌دیدند [و این عاملی برای ترس آنان می‌شد] و خداوند هر کس را بخواهد، به یاری خود تأیید می‌کند. در این امر برای اهل بینش، پند و عبرت است.,یقین جنگ بدر روبه‌رو نشانه درس عبرت خدا نبرد گروه کافر چشم مسلمان دید عاملی ترس خداوند کس خواست یاری تأیید اهل بینش پند عبرت 
3,14,عشق و علاقه به زنان و فرزندان و اموال زیاد از طلا و نقره و اسبان ممتاز و چهارپایان و کشت‌زارها که همه از شهوات و خواسته‌های نفسانی است، در نظر مردم جلوه یافته است، [در حالی که] اینها بهره‌ای گذرا از زندگانی دنیاست و سرانجامِ نیکو تنها نزد خداوند است.,عشق علاقه زنان فرزندان اموال طلا نقره اسبان ممتاز چهارپایان کشت‌زارها شهوات خواسته نفسانی مردم جلوه اینها بهره گذرا زندگانی دنیاست سرانجام نیکو نزد خداوند 
3,18,خدایی که همواره به عدل و قسط قیام دارد، گواهی داده که معبودی جز او نیست و فرشتگان و صاحبان دانش [نیز به یگانگی او گواهی داده‌اند]، جز او که مقتدر حکیم است، معبودی نیست.,خدایی عدل قسط قیام گواهی معبود فرشتگ صاحبان دانش یگانگی گواهی داد مقتدر حکیم معبود 
3,34,نسلی [پاک] که برخی از آنها از [نسل] برخی دیگرند و خداوند شنوای داناست.,نسلی پاک نسل دیگرند خداوند شنوا داناست 
3,37,پس پروردگارش او را به وجه نیکو پذیرفت و به نحو شایسته پرورش داد و سرپرستی او را به زکریا سپرد. هرگاه زکریا در محرابِ عبادت بر مریم وارد می‌شد، غذای مخصوصی نزد او می‌یافت. [روزی] گفت: «ای مریم! این روزی از کجا نصیب تو شده؟!» او در پاسخ گفت: «آن از نزد خداست. خداوند به هر کس که بخواهد، روزیِ بی‌شمار می‌دهد.»,پروردگار وجه نیکو پذیرفت نحو شایسته پرورش سرپرستی زکریا سپرد هرگاه زکریا محراب عبادت مریم غذای مخصوصی نزد یافت روزید ای مریم روزید کجا نصیب شده؟ پاسخ نزد خداست خداوند کس خواست روزید بی‌شمار 
3,39,پس در حالی که زکریا در محراب به نماز ایستاده بود، فرشتگان او را ندا دادند که: «خداوند تو را به یحیی بشارت می‌دهد که تصدیق‌کننده‌ی [مسیح،] کلمة اللّه است و سید و سرور، و خویشتن‌دار و پیامبری از صالحان است.»,زکریا محراب نماز ایستاده فرشتگ ندا خداوند یحیی بشارت تصدیق‌کننده مسیح کلمة الله سید سرور خویشتن‌دار پیامبری صالحان 
3,54,و [یهود برای نابودی عیسی و آیینش] توطئه کردند. خداوند نیز [برای حفظ او و آیینش] تدبیر نمود. و خداوند بهترین تدبیرکننده است.,یهود نابودی عیسی آیین توطئه خداوند حفظ آیین تدبیر نمود خداوند تدبیرکننده 
3,58,[ای پیامبر!] آنچه بر تو می‌خوانیم، آیه‌ها و اندرز حکمت‌آمیز است.,ای پیامبر خواند آیه اندرز حکمت‌آمیز 
3,104,و از میان شما باید گروهی باشند که [دیگران را] به خیر و نیکی دعوت نمایند و امر به معروف و نهی از منکر کنند. و آنان همان رستگارانند.,خیر نیکی دعوت نمایند معروف نهی منکر رستگارانند 
3,127,[امدادهای الهی برای آن بود] تا بعضی از کفّار را نابود کند یا خوارشان گرداند تا ناامید بازگردند.,امداد الهی کفار نابود خوار گرداند ناامید بازگشت 
3,131,و از آتشی که برای کافران آماده شده است، بپرهیزید.,آتشی کافر آماده‌شده پرهیخت 
3,150,[آنها یار و دوستدار شما نیستند،] بلکه خداوند مولای شماست و او بهترینِ یاوران است.,یار دوستدار خداوند مولای شماست یاور 
3,163,آنان نزد خداوند [دارای] مقام و درجاتی هستند و خداوند به آنچه انجام می‌دهند، بیناست.,نزد خداوند مقام درجات خداوند انجام بیناس 
3,174,پس به واسطه‌ی نعمت و فضل خداوند، [مجروحانی که برای بار دوم آماده دفاع شدند، بدون بروز جنگ، به مقرّ خود] بازگشتند، در حالی که هیچ گزندی به آنان نرسید و [همچنان] خشنودی خدا را دنبال کردند. و خداوند صاحب فضل بزرگی است.,واسطه نعمت فضل خداوند مجروحانی آماده دفاع جنگ مقر بازگشت گزند رسید خشنودی خدا دنبال خداوند صاحب فضل بزرگی 
4,3,و اگر می‌ترسید که نتوانید عدالت [میان همسران] را، در مورد دختران یتیم، مراعات کنید، [بجای آنان] با زنان دلخواه دیگر ازدواج کنید، دو یا سه یا چهار همسر. پس اگر می‌ترسید که نتوانید [میان آنان نیز] به عدالت رفتار کنید، [به] یک همسر یا کنیزی که مال شماست [بسنده کنید]. این کار، به ترک ظلم و ستم نزدیک‌تر است.,ترسید توانست عدالت همسر دخ یتیم مراعات بجای زنان دلخواه ازدواج همسر ترسید توانست عدالت رفتار همسر کنیزی مال شماست بسنده کار ترک ظلم ستم نزدیک 
4,4,و مهریه زنان را به عنوان هدیه و با رغبت به آنان بدهید. پس اگر با میل و رضایت خویش چیزی از آن را به شما بخشیدند، آن را حلال و گوارا مصرف کنید.,مهریه زنان عنوان هدیه رغبت داد میل رضایت بخشید حلال گوارا مصرف 
4,22,و زنانی را که پدرانتان با آنها ازدواج کرده‌اند، به همسری نگیرید، مگر آنچه در گذشته [پیش از نزول این حکم] انجام شده است. این گونه ازدواج، کاری زشت و تنفرآور، و راه و روشی نادرست است.,زنانی پدران ازدواج کرد همسری گرفت مگر گذشته نزول حکم انجام‌شده این‌گونه ازدواج کاشت زشت تنفرآور روش نادرست 
4,23,[ازدواج با این افراد] بر شما حرام شده است: مادرانتان و دخترانتان، و خواهرانتان و عمّه‌هایتان، و خاله‌هایتان، و دخترانِ برادر و دخترانِ خواهر، و مادرانی که به شما شیر داده‌اند، و خواهران هم‌شیر [که از آن مادر شیر خورده‌اند]، و مادران همسرانتان و دختران همسرانتان [از شوهر قبلی] که در دامن شما تربیت یافته‌اند، البته در صورتی که با مادرانشان، همبستر شده باشید، اما اگر آمیزش نکرده‌اید [و از آنان جدا شده‌اید]، مانعی ندارد [که با دختران آنها ازدواج کنید]، و [همچنین حرام است ازدواج با] همسران پسرانتان که از نسل شمایند، [نه پسر خوانده‌ها] و نباید دو خواهر را همزمان [به همسری] داشته باشید، مگر آنچه پیشتر رخ داده است. [که گناهش آمرزیده شده، ولی باید از یکی جدا شوید.] همانا خداوند آمرزنده و مهربان است.,ازدواج حرام مادران دخترانتان خواهران عمه خاله دخ برادر دخ خواهر مادرانی شیر داد خواهران هم‌شیر مادر شیر خورد مادران همسرانتان دخ همسرانتان شوهر قبلی دامن تربیت یافت صورتی مادران همبستر باشید آمیزش کرد جدا شد مانعی دخ ازدواج حرام ازدواج همسر پسرانتان نسل شمایند پسر خوانده خواهر همزمان همسری باشید مگر پیشتر رخ‌داده گناه آمرزیده جدا شد همانا خداوند آمرزنده مهربان 
4,24,و [ازدواج با] زنان شوهردار [نیز بر شما حرام است،] مگر آنان که [در جنگ با کفّار اسیر کرده و] مالک شده‌اید. [که اسارت آنها در حکم طلاق است. این احکام،] نوشته و قانون خدا بر شماست. و جز اینها [که بیان شد،] بر شما حلال است که [زنان دیگر را] با [پرداخت بخشی از] اموالتان، به قصد پاکدامنی اختیار کنید، نه به قصد زنا. پس هرگاه از زنان [با ازدواج موقّت] کام گرفتید، واجب است مهریه آنها را بپردازید و گناهی بر شما نیست که پس از تعیین مهریه، با رضایت یکدیگر [مقدار آن را] کم یا زیاد کنید. خداوند همواره دانا و حکیم است.,ازدواج زنان شوهردار حرام مگر جنگ کفار اسیر مالک شد اسارت حکم طلاق احکام نوشته قانون خدا شماست اینها حلال زنان پرداخت اموال قصد پاکدامنی اختیار قصد زنا هرگاه زنان ازدواج موقت کام گرفت واجب مهریه پرداخت گناهی مهریه رضایت مقدار خداوند دانا حکیم 
