sureh,ayeh,matn,processed matn
21,44,با این وجود، ما آنها و پدرانشان را [از انواع نعمت‌ها] بهره‌مند ساختیم تا آنجا که عمرشان طولانی شد [و مایه‌ی غرور و سرکشی آنان گردید]. آیا نمی‌بینند که ما همواره به زمین می‌پردازیم و از وسعت سرزمین‌ها[یی که در اختیار کافران بوده،‌] می‌کاهیم؟ آیا ایشان [بر ما] غلبه دارند؟,پدران انواع نعمت بهره‌مند ساخت عمرشان طولانی مایه غرور سرکشی گشت دید زمین پرداخت وسعت سرزمین اختیار کافر می‌کاهیم؟ غلبه دارند؟ 
21,53,آنان گفتند: «ما پدرانمان را پرستش‌کنندگان آنها یافته‌ایم!»,گفت پدران پرستش‌کنندگان یافت 
21,74,و به لوط، حکمت و دانش عطا کردیم و او را از قریه‌ای که کارهای زشت می‌کردند، رهانیدیم. به راستی آنان مردمی بد و منحرف بودند.,لوط حکمت دانش عطا کرد قریه کارهای زشت رهانیدیم راستی مردمی بد منحرف 
21,80,و برای شما به داوود فنّ زره‌سازی را آموختیم، تا شما را از [خطرات] جنگتان نگه دارد. پس آیا شما سپاسگزار هستید؟,داوود فن زره‌ساز آموخت خطرات جنگ نگه سپاسگزار هستید؟ 
21,86,و ما آنان را در رحمت خویش وارد ساختیم. به درستی که آنان از شایستگان بودند.,رحمت ساخت درستی شایستگان 
21,95,و بر [مردم] آبادی‌هایی که آنها را [به خاطر فساد و گناه] هلاک نمودیم، حرام است [که به دنیا بازگردند،] آنان بازنمی‌گردند.,مردم آبادی خاطر فساد گناه هلاک نمود حرام دنیا بازگشت بازنمی‌گردند 
21,106,همانا در این [پیش‌گویی]، برای گروهی پرستنده، پیامی روشن است.,همانا پیش‌گویی پرستنده پیامی روشن 
22,2,روزی که آن را مشاهده کنید، [از ترس و وحشت،] هر مادر شیردهی، شیرخواره‌اش را از یاد می‌برد، و هر بارداری، سقط جنین می‌کند. و مردم را مست می‌بینی، ولی مست نیستند، بلکه عذاب خداوند شدید است.,روزید مشاهده ترس وحشت مادر شیردهی شیرخواره یاد برد بارداری سقط‌جنین مردم مست دید مست عذاب خداوند شدید 
22,3,و از مردم، کسی هست که ناآگاهانه درباره‌ی خداوند به جدال می‌پردازد و از هر شیطانِ سرکشی پیروی می‌کند.,مردم هست ناآگاهانه درباره خداوند جدال پرداخت شیطان سرکشی پیروی 
22,13,بلکه کسی را می‌خواند که زیانش از سودش بیشتر است. چه مولا و سرپرست بدی! و چه همدم زشتی!,خواند زیان سود مولا سرپرست بدی همدم زشتی 
22,20,با آن مایع جوشان، آنچه در شكم‌های آنهاست، و [نیز] پوست بدنشان گداخته می‌شود.,مایع جوشان شکم آنهاست پوست بدنشان گداخته 
22,26,و [به یادآور] آن‌گاه که مکان کعبه را برای ابراهیم آماده ساختیم، [به او گفتیم:] هیچ‌گونه شرکی نسبت به من روا مدار! و خانه‌ی مرا برای طواف‌کنندگان و قیام‌کنندگان و رکوع‌کنندگانِ سجده‌گزار پاکیزه بدار!,یادآور آن‌گاه مکان کعبه ابراهیم آماده ساخت گفت هیچ‌گونه شرکی روا مدار خانه مرا طواف‌کنندگان قیام‌کنندگان رکوع‌کنندگان سجده‌گزار پاکیزه بدار 
22,27,و در میان مردم، بانگ حج برآور! تا آنان، پیاده و [یا] سوار بر مرکب‌های چابک، از هر راه دوری به سراغ تو بیایند.,مردم بانگ حج برآور پیاده سوار مرکب چابک دوری سراغ بیایند 
22,29,[زائران خانه‌ی خدا] سپس باید آلودگی خود را برطرف سازند، و به نذرهای خود وفا کنند، و بر گرد خانه‌ی کهن و آزاد [کعبه] طواف نمایند.,زائر خانه خدا آلودگی برطرف ساخت نذر وفا گرد خانه کهن آزاد کعبه طواف نمایند 
22,33,برای شما در آن [دام‌های قربانی] تا رسیدن زمان معین [عید قربان] منافعی است، [مانند سواری و تغذیه از شیر آنها،] سپس جایگاه آن [قربانی‌ها،] به سوی [کعبه،] خانه‌ی کهن و آزاد است.,دام قربانی زمان معین عید قربان منافع سواری تغذیه شیر جایگاه قربانی کعبه خانه کهن آزاد 
22,36,و شترهای چاق را برای شما از شعائر الهی قرار دادیم. در آنها برای شما خیر [و برکت] است. پس در حالی که [برای قربانی] در صف ایستاده‌اند، نام خدا را بر آنها ببرید، پس چون به پهلو افتادند [و جان دادند]، از آنها بخورید. و به [نیازمندان] قانع و [فقیران] درخواست‌کننده بخورانید، این‌گونه دام‌های قربانی را برای شما [رام و] مسخّر کردیم، شاید سپاسگزاری کنید.,شتر چاق شعائر الهی قرار داد خیر برکت قربانی صف ایستاد نام خدا برد پهلو افتاد جان خورد نیازمند قانع فقیران درخواست‌کننده بخورانید این‌گونه دام قربانی رام مسخر کرد سپاسگزاری 
22,39,به کسانی که مظلومانه مورد تهاجم و کشتار قرار گرفته‌اند، اجازه‌ی دفاع و جهاد داده شده است. و البتّه خداوند بر یاری آنان تواناست.,مظلومانه تهاجم کشتار قرار گرفت اجازه دفاع جهاد داده‌شده خداوند یاری تواناست 
22,53,تا [خداوند،] آنچه را شیطان [در دل‌ها] می‌افکند، آزمونی قرار دهد برای آنان که در دل‌هایشان [نوعی] بیماری است، و [نیز] برای سنگ‌دلان. و قطعاً ستمگران در جدایی [و ستیزی] دور و درازند.,خداوند شیطان دل افکند آزمون قرار دل بیماری سنگ‌دلان قطعا ستمگر جدایی ستیزی درازید 
23,3,و آنان كه از بیهودگی روی‌گردانند.,بیهودگی روی‌گردانند 
23,10,آنان وارثانند،,وارثانند 
23,14,سپس از نطفه، لخته خونی آفریدیم. آن‌گاه لخته خون را پاره گوشتی ساختیم، و پاره گوشت را به صورت استخوان‌هایی درآوردیم، و استخوان‌ها را گوشتی پوشاندیم. سپس آن را آفرینش تازه‌ای دادیم، پس آفرین بر خدا، و پرخیر و بركت است او كه بهترینِ آفرینندگان است.,نطفه لخته خونی آفرید آن‌گاه لخته خون پاره گوشتی ساخت پاره گوشت صورت استخوان درآوردیم استخوان گوشتی پوشاند آفرینش تازه داد آفرین خدا پرخیر برکت آفرینندگان 
23,20,و [نیز زیتون‌،] درختی که از طور سینا می‌روید، [و] روغن و خوراک برای خورندگان به بار می‌آورد.,زیتون درختی سینا رست روغن خوراک خورندگان آورد 
23,21,و برای شما در چهارپایان عبرتی است، از آنچه در درون آنهاست، به شما [شیر] می‌نوشانیم. و در آنها برای شما منافع بسیاری است. و از [گوشت] آنها می‌خورید.,چهارپایان عبرت آنهاست شیر می‌نوشانیم منافع گوشت خورد 
23,53,امّا مردم، کارشان را در میان خود، به پراکندگی کشاندند، هر گروهی به راهی رفتند، و هر حزب و دسته‌ای به آنچه نزدشان بود، دل خوش کردند.,مردم کارشان پراکندگی کشاند راهی رفت حزب دسته نزد دل‌خوش 
23,54,پس آنان را تا مدّتی در گرداب جهلشان واگذار.,مدتی گرداب جهل واگذار 
23,56,شتاب می‌کنیم که خیرهایی به آنان برسانیم؟ [چنین نیست!] بلکه آنان نمی‌فهمند [مال و فرزند وسیله آزمایش است].,شتاب خیر برسانیم؟ فهمید مال فرزند وسیله آزمایش 
23,61,چنین کسانی در خیرات شتاب می‌ورزند. و همانان هستندکه در [رسیدن به] خیرات از یکدیگر پیشی می‌گیرند.,خیرات شتاب ورزید همانان هستندکه خیرات پیشی گرفت 
23,64,تا زمانی که مرفّهان [مغرور] را به قهر خود گرفتار سازیم. در این هنگام ناله سر می‌دهند.,زمانی مرفه مغرور قهر گرفتار ساخت ناله سر 
23,68,آیا آنها در این گفتار نیندیشیدند؟ یا مطالبی [تازه] برای آنان آمده که برای نیاکانشان نیامده است؟,گفتار نیندیشیدند؟ مطالبی تازه نیاکان نیامده است؟ 
23,70,یا می‌گویند: «او جنون دارد؟» [چنین نیست!] بلکه او حقّ را برای آنان آورده، امّا بیشترشان [پذیرش] حقّ را خوش ندارند.,جنون دارد؟ حق آورده بیشتر پذیرش حق خوش 
23,75,و اگر به آنها رحم کنیم و بدبختی‌های آنان را برطرف سازیم، [به‌جای هوشیاری و شکرگزاری،] کوردلانه در طغیانشان لجاجت می‌ورزند.,رحم بدبختی برطرف ساخت به‌جای هوشیاری شکرگزاری کوردلانه طغیان لجاجت ورزید 
23,81,بلکه [آنان نیز] سخنی همانند گفته‌ی پیشینیان گفتند.,سخنی همانند گفته پیشینیان گفت 
23,96,[ای پیامبر!] بدی را به بهترین شیوه دور کن! [و در مقام مقابله به مثل مباش!] ما به آنچه [مخالفان] وصف می‌کنند، آگاه‌تریم.,ای پیامبر بدی شیوه کن مقام مقابله مبا مخالف وصف آگاه‌تریم 
23,102,پس کسانی که ترازوهای اعمالشان سنگین [و باارزش] باشد، آنان همان رستگارانند.,ترازو اعمال سنگین باارزش رستگارانند 
23,115,پس آیا می‌پندارید که ما شما را بیهوده آفریده‌ایم؟ و شما به سوی ما بازگردانده نمی‌شوید؟,پندارید بیهوده آفریده‌ایم؟ بازگردانده نمی‌شوید؟ 
24,3,مرد زناکار، جز با زن زناکار یا مشرک ازدواج نمی‌کند. و زن زناکار را، جز مرد زناکار یا مشرک، به همسری نمی‌گیرد. و این [زناشویی] بر مؤمنان حرام است!,مرد زناکار زن زناکار مشرک ازدواج کرد زن زناکار مرد زناکار مشرک همسری گرفت زناشویی مؤمنان حرام 
24,4,و کسانی که نسبت زنا به زنان پاکدامن می‌دهند و چهار شاهد نمی‌آورند، پس هشتاد تازیانه به آنان بزنید و گواهی آنان را هرگز نپذیرید، که آنان همان فاسقانند.,زنا زنان پاکدامن شاهد آورد هشتاد تازیانه زد گواهی هرگز پذیرفت فاسقانند 
24,26,زنان پلید، سزاوار مردان پلیدند، و مردان پلید، سزاوار زنان پلید. زنان پاک، برای مردان پاکند، و مردان پاک، برای زنان پاک. آنان از آنچه درباره‌ی آنها می‌گویند، برکنارند. و برای آنان آمرزش و روزی نیکویی است.,زنان پلید سزاوار مردان پلیدند مردان پلید سزاوار زنان پلید زنان پاک مردان پاکند مردان پاک زنان پاک درباره برکنارند آمرزش روزید نیکویی 
24,30,به مردان مؤمن بگو: چشم‌های خود را [از نگاه به نامحرمان] فروگیرند، و دامان خود را [از آلودگی] حفظ نمایند. این برای پاک‌تر ماندن آنان [بهتر] است. خداوند به آنچه می‌کنند، آگاه است.,مردان مؤمن بگو چشم نگاه نامحرمان فروگیرند دامان آلودگی حفظ نمایند پاک ماندن خداوند آگاه 
24,35,خداوند، نور آسمان‌ها و زمین است. مثل نور او، همچون چراغدانی است که در آن چراغی [پر فروغ] باشد. آن چراغ در میان شیشه‌ای، و آن شیشه، همچون ستاره‌ای تابان و درخشان. این چراغ از روغن درخت پر برکت زیتون برافروخته است، که نه شرقی است و نه غربی [و پیوسته خورشید بر آن می‌تابد. روغنش به قدری صاف و شفّاف است] که بدون تماس آتش، نزدیک است [شعله‌ور شود و] روشنی دهد. نوری است بر فراز نور دیگر. هر کس را که خداوند بخواهد، به نور خویش هدایت می‌کند. و خداوند برای مردم مثل‌ها می‌زند، و به هر چیزی آگاه است.,خداوند نور آسمان زمین نور چراغدان چراغی فروغ چراغ شیشه شیشه ستاره تابان درخشان چراغ روغن درخت برکت زیتون برافروخته شرقی غربی پیوسته خورشید تافت روغن قدری صاف شفاف تماس آتش شعله‌ور روشنی نوری فراز نور کس خداوند خواست نور هدایت خداوند مردم مثل زد آگاه 
24,59,و چون کودکان شما به حد بلوغ رسیدند، باید [در تمام اوقات برای ورود به اتاق خصوصی پدر و مادر] اجازه بگیرند. مانند کسانی که پیش از آنان اجازه می‌گرفتند. خداوند این‌گونه آیات خود را برای شما بیان می‌کند. و خداوند دانایی فرزانه است.,کودک بلوغ رسید اوقات ورود اتاق خصوصی پدر مادر اجازه گرفت اجازه گرفت خداوند این‌گونه آیات خداوند دانایی فرزانه 
24,60,و بر زنان سالخورده‌ای که امیدی به ازدواج ندارند، گناهی نیست که حجاب و روپوش خود را کنار بگذارند، به شرطی که زیورشان را آشکار و خودآرایی نکنند. و پاکدامنی [و پوشش] برای آنان بهتر است. و خداوند شنوای دانا است.,زنان سالخورده امیدی ازدواج گناهی حجاب روپوش گذارد شرطی زیور آشکار خودآرایی کرد پاکدامنی پوشش خداوند شنوا دانا 
24,61,بر نابینا و لنگ و بیمار و بر خود شما ایرادی نیست که [بدون اجازه از این خانه‌ها، غذا] بخورید: از خانه‌های خود، یا خانه‌های پدرانتان، یا خانه‌های مادرانتان، یا خانه‌های برادرانتان، یا خانه‌های خواهرانتان، یا خانه‌های عموهایتان، یا خانه‌های عمّه‌هایتان، یا خانه‌های دایی‌هایتان، یا خانه‌های خاله‌هایتان، یا آن خانه‌هایی که کلیدهایش را در اختیار دارید، یا خانه‌های دوستانتان. بر شما گناهی نیست که دسته‌جمعی بخورید یا پراکنده [و تنها]. و چون وارد هر خانه‌ای شدید، پس بر یکدیگر سلام کنید، سلام و تحیتی از سوی خداوند، سلامی خجسته و پاکیزه! خداوند آیات را این چنین برای شما بیان می‌کند. باشد که بیندیشید.,نابینا لنگ بیمار ایراد اجازه خانه‌ها غذا خورد خانه خانه پدران خانه مادران خانه برادرانتان خانه خواهران خانه عمو خانه عمه خانه دایی خانه خاله خانه کلید اختیار داشت خانه دوستان گناهی دسته‌جمعی خورد پراکنده خانه شدید سلام سلام تحیت خداوند سلامی خجسته پاکیزه خداوند آیات این‌چنین بیندیشید 
25,9,بنگر که چگونه برای تو مَثَل‌ها زدند؟ [و تو را چگونه وصف کردند؟] پس گمراه شدند؛ در نتیجه نمی‌توانند راهی [به حقیقت] بیابند.,بنگر مثل زدند؟ وصف کردند؟ گمراه شدند؛ نتیجه توانست راهی حقیقت یابید 
25,13,و چون به زنجیر بسته شده، در مکانی تنگ انداخته شوند، آنجاست که ناله می‌زنند.,زنجیر بسته‌شده مکانی تنگ انداخته آنجاست ناله زد 
25,19,[خداوند می‌فرماید:] «پس [این معبودها] گفته‌های شما را تکذیب کردند. [اکنون] در چاره‌اندیشی [برای خود] و یاری رساندن [به خویش] توانی ندارید. و هر کس از شما ستم کند [و شرک ورزد]، عذاب بزرگی به او می‌چشانیم.»,خداوند فرمود معبود گفته تکذیب چاره‌اندیشی یاری‌رساندن توانی داشت کس ستم شرک ورزید عذاب بزرگی می‌چشانیم 
25,34,کسانی که به رو درافتاده، به سوی جهنّم محشور می‌شوند، آنان بدترین جای را دارند، و گمراه‌ترینِ مردمند.,درافتاده جهنم محشور بدترین گمراه مردمند 
25,40,به‌راستی [مشرکان مکه، هنگام مسافرت به شام] بر آبادی [قوم لوط] که بارانِ عذاب بر آن باریده، گذر کرده‌اند. پس آیا آنجا را ندیده‌اند؟ چرا! ولی [عبرت نگرفته‌اند، زیرا] آنان به رستاخیز، امید و ایمانی ندارند.,به‌راستی مشرک مکه مسافرت شام آبادی قوم لوط باران عذاب باریده گذر کرد ندیده‌اند؟ عبرت گرفت رستاخیز امید ایمان 
25,46,سپس آن سایه را [با بلند شدن آفتاب‌،] به سوی خود جمع می‌کنیم.,سایه بلند آفتاب 
25,67,و آنان که هرگاه انفاق کنند، نه از حد بگذرند، و نه تنگ گیرند و میان این دو، اعتدال دارند.,هرگاه انفاق گدشت تنگ گرفت اعتدال 
26,1,طا، سین، میم.,طا سین  
26,15,خداوند فرمود: چنین نیست! پس [تو و هارون] همراه با معجزات ما بروید، که ما با شما و شنونده [گفتگوهایتان] هستیم.,خداوند فرمود هارون همراه معجزات رست شنونده گفتگو 
26,37,تا هر جادوگر ماهری را نزد تو بیاورند.»,جادوگر ماهری نزد بیاورند 
26,38,پس جادوگران در موعدِ روزی معلوم، گردآوری شدند.,جادوگر موعد روزید معلوم گردآوری 
26,39,و به مردم گفته شد: «آیا شما نیز جمع می‌شوید؟,مردم می‌شوید؟ 
26,40,به این امید که اگر جادوگران پیروز شدند، از [آیینِ] آنان پیروی کنیم.»,امید جادوگر پیروز آیین پیروی 
26,54,«اینها گروهی اندکند.,اینها اندکند 
26,56,ما همگی آماده‌ی دفاع هستیم.»,همگی آماده دفاع 
26,74,گفتند: «[نه!] بلكه پدرانمان را یافته‌ایم كه این‌گونه [پرستش] می‌كردند!»,گفت پدران یافت این‌گونه پرستش 
26,76,شما و پدران پیشین شما؟,پدران پیشین شما؟ 
26,79,او كه به من می‌خورانَد و می‌نوشانَد.,خوراند می‌نوشاند 
26,86,و از پدرم، درگذر، که او از گمراهان است.,پدر درگذر گمراه 
26,88,روزی که مال و فرزندان سودی ندارند،,روزید مال فرزندان سودی 
26,92,و به آنان گفته شود: «کجاست آنچه می‌پرستیدید،,کجاست پرستید 
26,111,آنان گفتند: «آیا ما به تو ایمان بیاوریم، در حالی که فرومایگان از تو پیروی کرده‌اند؟»,گفت ایمان بیاوریم فرومایگان پیروی کرده‌اند؟ 
26,115,من تنها هشداردهنده‌ای روشنگرم!»,هشداردهنده روشنگر 
26,128,آیا از سر هوا و هوس، بر هر بلندی، برجی برافراشته می‌سازید؟,سر هوا هوس لندید برجی برافراشته می‌سازید؟ 
26,133,[خداوند] با چارپایان و فرزندان، به شما یاری داده است،,خداوند چارپا فرزندان یاری 
26,137,این، جز شیوه‌ی پیشینیان نیست.,شیوه پیشینیان 
26,148,و کشت‌زارها و نخل‌هایی که شکوفه‌اش لطیف و [شاخه‌هایش] بر هم نشسته است.,کشت‌زارها نخل شکوفه لطیف شاخه نشسته 
26,149,و شما از کوه‌ها، خانه‌هایی برای خوشگذرانی می‌تراشید.,کوه خانه خوشگذرانی تراشید 
26,155,[پس ماده شتری از دل کوه بیرون آمد. صالح] گفت: «این ماده شتری است! سهمی از آب [چشمه‌]، برای اوست. و برای شما روز دیگری معین شده است.,ماده شتری دل کوه صالح ماده شتری سهمی آب چشمه اوست روز معین‌شده 
26,157,پس ناقه را پِی کردند [و آن را کشتند]، سپس [از کرده‌ی خود] پشیمان شدند.,ناقه کشت کرده پشیمان 
26,165,آیا از میان مردم جهان، شما به سراغ مردها می‌روید [و با آنان آمیزش می‌کنید]؟,مردم جهان سراغ مردها رست آمیزش می‌کنید؟ 
26,168,[لوط] گفت: «من دشمن سرسخت کردار شما هستم.,لوط دشمن سرسخت کردار  
26,177,زمانی که شعیب به آنان گفت: «آیا پروا نمی‌کنید؟,زمانی شعیب پروا نمی‌کنید؟ 
26,181,حقّ پیمانه را ادا کنید. و از کم‌فروشان نباشید.,حق پیمانه ادا کم‌فروشان باشید 
26,182,و با ترازویِ درست بسنجید.,ترازوی درست سخت 
26,183,و از اجناس مردم، نکاهید. و در زمین به فساد و تبهکاری نکوشید.,اجناس مردم کاست زمین فساد تبهکار کوشید 
26,184,و از خدایی که شما و اقوام پیشین را آفریده، پروا کنید.»,خدایی اقوام پیشین آفریده پروا 
26,186,تو نیز بشری همچون مایی. و ما تو را از دروغگویان می‌پنداریم.,بشری مایی دروغگو پندارید 
26,187,پس اگر تو از راستگویانی، پاره‌هایی از آسمان را بر سر ما بیفکن!»,راستگویان پاره آسمان سر بیفکن 
26,194,بر دل تو، تا از هشداردهندگان باشی.,دل هشداردهندگان باشید 
26,216,پس اگر [خویشان نزدیکت،] سرپیچی کردند، بگو: «من قطعاً از آنچه انجام می‌دهید، بیزارم!»,خویشان نزدیک سرپیچی بگو قطعا انجام داد بیزار 
26,219,و گردش و حرکت تو را در میان سجده‌کنندگان [نیز می‌بیند].,گردش حرکت سجده‌کنندگان دید 
26,220,زیرا که اوست شنوا و دانا.,اوست شنوا دانا 
26,221,آیا به شما خبر دهم که شیطان‌ها بر چه کسی فرود می‌آیند؟,خبر دهم شیطان فرود می‌آیند؟ 
